{
  "$schema": "https://json-schema.org/draft/2020-12/schema",
  "$id": "technical_alpha_feasibility_experiment.v2.json",
  "title": "A-share Technical Alpha Feasibility Experiment V2",
  "type": "object",
  "additionalProperties": false,
  "required": [
    "schema_version", "experiment_id", "strategy_id", "research_status",
    "stock_basic_status", "stock_basic_request_count", "security_master_pit_status",
    "frozen_implementation", "dates", "source", "index", "requests",
    "signal_total_return", "portfolio", "feasibility_timing", "costs", "gate", "not_simulated",
    "locked_test_status", "locked_test_consumed", "safety"
  ],
  "properties": {
    "schema_version": {"const": "technical-alpha-feasibility-experiment.v2"},
    "experiment_id": {"const": "a-share-technical-alpha-feasibility-tushare-p1-v1"},
    "strategy_id": {"const": "a-share-technical-momentum-adaptive-v1"},
    "research_status": {"const": "research_alpha_feasibility_only"},
    "stock_basic_status": {"const": "DEFERRED_NOT_REQUIRED_FOR_ALPHA_FEASIBILITY"},
    "stock_basic_request_count": {"const": 0},
    "security_master_pit_status": {"const": "NOT_IMPLEMENTED_NOT_REQUIRED_IN_P1"},
    "frozen_implementation": {
      "const": {
        "alpha_policy_path": "configs/a_share_technical_shadow_mvp.v1.json",
        "alpha_policy_sha256": "53b7f2b3da72a2d393c18b4fc61afac9e1a3f63c2cd86756cbd1bd0d47eb77ea",
        "alpha_source_path": "research/strategy_workspace/technical_alpha_shadow_v1.py",
        "alpha_source_sha256": "3cd734c8770e5647754fa21d65e8d6a789da3c17958fb2b2b15352268af3d922",
        "ranker_source_path": "research/strategy_workspace/technical_formal_backtest.py",
        "ranker_source_sha256": "33cd919f8928a532caa798341c2656d423e68655befff6792aa4223a281a31d3",
        "exposure_source_path": "research/strategy_workspace/technical_exposure_shadow_v1.py",
        "exposure_source_sha256": "4a204237752dec4797c2f80cf5950d638aa4d638f2ece615a29ace62f14d0ca7"
      }
    },
    "dates": {
      "const": {
        "signal_warmup_start": "2017-07-01",
        "development_start": "2018-01-01",
        "development_end": "2022-12-31",
        "validation_start": "2023-01-01",
        "validation_end": "2023-12-31",
        "absolute_request_and_consumer_cutoff": "2023-12-31",
        "terminal_session_has_no_cross_cutoff_next_session": true
      }
    },
    "source": {
      "type": "object",
      "required": ["provider", "transport_target", "token_environment_variable", "allowed_endpoints", "forbidden_endpoint_suffix", "redirects_allowed", "automatic_retries", "request_timeout_seconds", "maximum_response_bytes", "minimum_request_interval_seconds", "token_persistence_forbidden", "field_level_fallback_forbidden", "baostock_field_level_fallback_forbidden"],
      "properties": {
        "provider": {"const": "tushare_standard_non_vip"},
        "transport_target": {"const": "https://api.tushare.pro"},
        "token_environment_variable": {"const": "TUSHARE_TOKEN"},
        "allowed_endpoints": {"const": ["trade_cal", "index_weight", "daily", "adj_factor", "index_daily", "suspend_d"]},
        "forbidden_endpoint_suffix": {"const": "_vip"},
        "redirects_allowed": {"const": false},
        "automatic_retries": {"const": 0},
        "request_timeout_seconds": {"type": "integer", "minimum": 1, "maximum": 60},
        "maximum_response_bytes": {"type": "integer", "minimum": 1024, "maximum": 2097152},
        "minimum_request_interval_seconds": {"type": "string", "pattern": "^[0-9]+(?:\\.[0-9]+)?$"},
        "token_persistence_forbidden": {"const": true},
        "field_level_fallback_forbidden": {"const": true},
        "baostock_field_level_fallback_forbidden": {"const": true}
      },
      "additionalProperties": false
    },
    "index": {"type": "object"},
    "requests": {
      "type": "object",
      "additionalProperties": false,
      "required": ["trade_cal", "index_weight", "daily", "adj_factor", "suspend_d", "index_daily"],
      "properties": {
        "trade_cal": {"type": "object"},
        "index_weight": {"type": "object"},
        "daily": {"type": "object"},
        "adj_factor": {"type": "object"},
        "suspend_d": {"type": "object"},
        "index_daily": {"type": "object"}
      }
    },
    "signal_total_return": {"type": "object"},
    "portfolio": {"type": "object"},
    "feasibility_timing": {
      "const": {
        "decision_time": "D_close",
        "rebalance_time": "D_plus_1_open",
        "held_interval_return": "adjusted_close_to_adjusted_open_then_adjusted_open_to_adjusted_close",
        "new_target_return": "D_plus_1_adjusted_open_to_adjusted_close",
        "broker_fill_simulation": false
      }
    },
    "costs": {"type": "object"},
    "gate": {
      "type": "object",
      "required": ["validation_base_net_active_return_min_exclusive", "validation_stress_net_active_return_min_inclusive", "validation_max_drawdown_max_inclusive", "largest_stock_pnl_share_max_inclusive", "largest_10_days_pnl_share_max_inclusive", "concentration_warning_blocks_go_candidate", "parameter_search_forbidden", "validation_driven_retraining_forbidden"],
      "properties": {
        "validation_base_net_active_return_min_exclusive": {"const": "0"},
        "validation_stress_net_active_return_min_inclusive": {"const": "0"},
        "validation_max_drawdown_max_inclusive": {"const": "0.12"},
        "largest_stock_pnl_share_max_inclusive": {"const": "0.50"},
        "largest_10_days_pnl_share_max_inclusive": {"const": "0.50"},
        "concentration_warning_blocks_go_candidate": {"const": true},
        "parameter_search_forbidden": {"const": true},
        "validation_driven_retraining_forbidden": {"const": true}
      },
      "additionalProperties": false
    },
    "not_simulated": {"type": "array", "items": {"type": "string", "minLength": 1}, "uniqueItems": true},
    "locked_test_status": {"$ref": "pit_membership_coverage_report.v1.json#/$defs/locked"},
    "locked_test_consumed": {"const": false},
    "safety": {"$ref": "tushare_alpha_feasibility_manifest.v2.json#/$defs/safety"}
  }
}
